<?xml version="1.0"?>
<!DOCTYPE image SYSTEM "weaver-2.0.dtd">
<image>
	<machine file="data/eg_weave/machine.xml" />
	<virtual_pool name="virtual">
		<memory base="0x1000" size="0xcffff000"/>
	</virtual_pool>

	<physical_pool name="physical">
		<memory base="0xa0000000" size="0x3800000"/>
	</physical_pool>

	<kernel file="data/eg_weave/l4kernel" virtpool="virtual" physpool="physical">
	</kernel>

	<iguana name="iguana_server" file="data/eg_weave/ig_server" kernel_heap="2M">
	        <!-- Load all segments with a custom pager. -->
        	<program name="ig_naming" file="data/eg_weave/ig_naming" pager="memload">
		</program>
	</iguana>
</image>
